{
  "asset_plan_id": "PD-2026-007-riley-asset-plan-v001",
  "episode_id": "PD-2026-007-riley",
  "revision": "v001",
  "requirements": [
    {"requirement_id": "REQ-S001-IMG-001", "scene_id": "S001", "shot_id": "S001-SH001", "visual_mode": "reenactment", "priority": "hero", "candidate_count": 6, "continuity_refs": ["present_phone", "symbolic_arrest_pov"], "rights_class": "ai_symbolic_reconstruction_no_likeness", "fallback": "Macro phone-in-pocket object shot with Remotion text."},
    {"requirement_id": "REQ-S002-IMG-001", "scene_id": "S002", "shot_id": "S002-SH001", "visual_mode": "object", "priority": "A", "candidate_count": 4, "continuity_refs": ["present_phone", "wallet_vs_phone"], "rights_class": "ai_symbolic_reconstruction_no_likeness", "fallback": "Remotion phone silhouette opening into icon layers."},
    {"requirement_id": "REQ-S003-IMG-001", "scene_id": "S003", "shot_id": "S003-SH001", "visual_mode": "location", "priority": "B", "candidate_count": 3, "continuity_refs": ["san_diego_2009", "anonymous_vehicle"], "rights_class": "ai_symbolic_reconstruction_no_likeness", "fallback": "Remotion abstract San Diego locator map."},
    {"requirement_id": "REQ-S004-IMG-001", "scene_id": "S004", "shot_id": "S004-SH001", "visual_mode": "reenactment", "priority": "A", "candidate_count": 4, "continuity_refs": ["anonymous_vehicle", "no_identifiable_faces"], "rights_class": "ai_symbolic_reconstruction_no_likeness", "fallback": "Evidence-table object macro."},
    {"requirement_id": "REQ-S004-IMG-002", "scene_id": "S004", "shot_id": "S004-SH002", "visual_mode": "object", "priority": "B", "candidate_count": 3, "continuity_refs": ["evidence_table"], "rights_class": "ai_symbolic_reconstruction_no_likeness", "fallback": "Phone and sealed evidence bag, no readable labels."},
    {"requirement_id": "REQ-S005-IMG-001", "scene_id": "S005", "shot_id": "S005-SH001", "visual_mode": "object", "priority": "A", "candidate_count": 4, "continuity_refs": ["present_phone", "evidence_table"], "rights_class": "ai_symbolic_reconstruction_no_likeness", "fallback": "Remotion split-screen with no-warrant stamp."},
    {"requirement_id": "REQ-S006-IMG-001", "scene_id": "S006", "shot_id": "S006-SH001", "visual_mode": "object", "priority": "C", "candidate_count": 2, "continuity_refs": ["case_file", "neutral_defendant_language"], "rights_class": "ai_symbolic_reconstruction_no_likeness", "fallback": "Typography-only charge escalation card."},
    {"requirement_id": "REQ-S007-IMG-001", "scene_id": "S007", "shot_id": "S007-SH001", "visual_mode": "object", "priority": "A", "candidate_count": 4, "continuity_refs": ["smartphone_and_flip_phone"], "rights_class": "ai_symbolic_reconstruction_no_likeness", "fallback": "Two-phone Remotion lower third."},
    {"requirement_id": "REQ-S010-IMG-001", "scene_id": "S010", "shot_id": "S010-SH001", "visual_mode": "object", "priority": "B", "candidate_count": 3, "continuity_refs": ["wallet_vs_phone"], "rights_class": "ai_symbolic_reconstruction_no_likeness", "fallback": "Wallet and phone rendered as Remotion shapes."},
    {"requirement_id": "REQ-S011-IMG-001", "scene_id": "S011", "shot_id": "S011-SH001", "visual_mode": "data_visualization", "priority": "A", "candidate_count": 4, "continuity_refs": ["wallet_vs_phone", "data_layers"], "rights_class": "ai_symbolic_reconstruction_no_likeness", "fallback": "Fully Remotion wallet-vs-phone data animation."},
    {"requirement_id": "REQ-S012-IMG-001", "scene_id": "S012", "shot_id": "S012-SH001", "visual_mode": "diagram", "priority": "A", "candidate_count": 4, "continuity_refs": ["present_phone", "cloud_threads"], "rights_class": "ai_symbolic_reconstruction_no_likeness", "fallback": "Remotion pocket-to-cloud network diagram."},
    {"requirement_id": "REQ-S014-IMG-001", "scene_id": "S014", "shot_id": "S014-SH001", "visual_mode": "location", "priority": "B", "candidate_count": 3, "continuity_refs": ["scotus_symbolic"], "rights_class": "ai_symbolic_reconstruction_no_likeness", "fallback": "Timeline and citation card only; no courthouse image."},
    {"requirement_id": "REQ-S015-IMG-001", "scene_id": "S015", "shot_id": "S015-SH001", "visual_mode": "abstract", "priority": "A", "candidate_count": 4, "continuity_refs": ["data_layers", "anonymous_life_mosaic"], "rights_class": "ai_symbolic_reconstruction_no_likeness", "fallback": "Abstract phone silhouette with non-branded icons."},
    {"requirement_id": "REQ-S016-IMG-001", "scene_id": "S016", "shot_id": "S016-SH001", "visual_mode": "diagram", "priority": "B", "candidate_count": 2, "continuity_refs": ["data_layers"], "rights_class": "ai_symbolic_reconstruction_no_likeness", "fallback": "Remotion house-versus-phone scale comparison."},
    {"requirement_id": "REQ-S018-IMG-001", "scene_id": "S018", "shot_id": "S018-SH001", "visual_mode": "archival_illustration", "priority": "B", "candidate_count": 3, "continuity_refs": ["katz_phone_booth", "privacy_bubble"], "rights_class": "ai_symbolic_reconstruction_no_likeness", "fallback": "Phone-booth line art in Remotion."},
    {"requirement_id": "REQ-S019-IMG-001", "scene_id": "S019", "shot_id": "S019-SH001", "visual_mode": "object", "priority": "B", "candidate_count": 3, "continuity_refs": ["smartphone_and_flip_phone"], "rights_class": "ai_symbolic_reconstruction_no_likeness", "fallback": "Two phones under one Remotion bracket."},
    {"requirement_id": "REQ-S022-IMG-001", "scene_id": "S022", "shot_id": "S022-SH001", "visual_mode": "abstract", "priority": "A", "candidate_count": 4, "continuity_refs": ["anonymous_life_mosaic", "no_brand_icons"], "rights_class": "ai_symbolic_reconstruction_no_likeness", "fallback": "Remotion app mosaic with generic icons."},
    {"requirement_id": "REQ-S022-IMG-002", "scene_id": "S022", "shot_id": "S022-SH002", "visual_mode": "object", "priority": "B", "candidate_count": 3, "continuity_refs": ["anonymous_life_mosaic", "no_brand_icons"], "rights_class": "ai_symbolic_reconstruction_no_likeness", "fallback": "Locked phone with generic app-glow layers."},
    {"requirement_id": "REQ-S023-IMG-001", "scene_id": "S023", "shot_id": "S023-SH001", "visual_mode": "data_visualization", "priority": "A", "candidate_count": 4, "continuity_refs": ["location_trail", "carrier_cloud"], "rights_class": "ai_symbolic_reconstruction_no_likeness", "fallback": "Remotion phone-to-cell-tower trail."},
    {"requirement_id": "REQ-S025-IMG-001", "scene_id": "S025", "shot_id": "S025-SH001", "visual_mode": "object", "priority": "B", "candidate_count": 3, "continuity_refs": ["present_phone", "gold_warrant_stamp"], "rights_class": "ai_symbolic_reconstruction_no_likeness", "fallback": "Locked phone with warrant path graphic."},
    {"requirement_id": "REQ-S027-IMG-001", "scene_id": "S027", "shot_id": "S027-SH001", "visual_mode": "data_visualization", "priority": "A", "candidate_count": 4, "continuity_refs": ["location_trail", "carpenter_tease"], "rights_class": "ai_symbolic_reconstruction_no_likeness", "fallback": "Abstract map path rendered in Remotion."}
  ]
}
